Post_ID,Blog_Title,Content_Type,Target_Audience,Category,Difficulty_Level,Format,Publication_Date,Status,Instagram_Reach,Instagram_Engagement,Instagram_Saves,TikTok_Views,TikTok_Engagement,YouTube_Views,YouTube_Engagement,Facebook_Reach,Facebook_Engagement,Blog_Views,Blog_Time_on_Page,Blog_Bounce_Rate,Email_Clicks,Email_CTR,Referral_Traffic,Conversion_Rate,Notes
1,The Complete Guide to Freestyle Technique: Master the 4 Pillars of Efficient Swimming,Educational,All,Technique,Intermediate,Blog + Video,4/21/2026,Published,8000,800,400,45000,3600,12000,1200,15000,1500,5000,4:30,25%,250,8%,150,3%,Comprehensive masterclass
2,From Fear to Confidence: How to Overcome Water Anxiety in 30 Days,Motivational,Parents,Psychology,Beginner,Blog + Video,4/22/2026,Published,12000,1200,600,65000,5200,8000,800,18000,1800,6000,5:00,20%,300,10%,200,4%,Emotional transformation focus
3,The Science Behind Efficient Breathing: Why Your Technique Matters,Educational,Competitive,Technique,Intermediate,Blog + Infographic,4/23/2026,Published,7000,700,350,35000,2800,10000,1000,12000,1200,4500,4:00,28%,200,7%,120,2.50%,Breathing mechanics deep dive
4,5 Mistakes Even Advanced Swimmers Make (And How to Fix Them),Educational,Competitive,Technique,Advanced,Blog + Video,4/24/2026,Published,9000,900,450,50000,4000,14000,1400,16000,1600,5500,4:45,22%,280,9%,180,3.50%,Common errors analysis
5,Open Water Swimming: The Ultimate Beginner's Guide to Safety and Technique,Educational,Adults,Open Water,Beginner,Blog + Video,4/25/2026,Published,10000,1000,500,55000,4400,11000,1100,17000,1700,5800,4:15,24%,290,9.50%,190,3.80%,Safety-focused content
6,How to Build a Sustainable Swimming Training Plan (Without Burnout),Educational,Competitive,Training,Intermediate,Blog + Worksheet,4/26/2026,Published,8500,850,425,40000,3200,9500,950,14000,1400,5200,4:30,26%,260,8.50%,160,3.20%,Training methodology
7,The Psychology of Swimming: Mental Strategies for Peak Performance,Educational,Competitive,Psychology,Intermediate,Blog + Video,4/27/2026,Published,9500,950,475,48000,3840,13000,1300,15500,1550,5600,4:40,23%,280,9%,175,3.60%,Mental performance focus
8,Water Polo Fundamentals: Everything You Need to Know to Get Started,Educational,Kids,Water Polo,Beginner,Blog + Video,4/28/2026,Published,7500,750,375,38000,3040,8500,850,13000,1300,4800,3:50,30%,240,8%,140,2.80%,Sport introduction
9,Nutrition for Swimmers: Fuel Your Body for Maximum Performance,Educational,Competitive,Nutrition,Intermediate,Blog + Infographic,4/29/2026,Published,8000,800,400,42000,3360,10500,1050,14500,1450,5100,4:20,27%,255,8.30%,155,3.10%,Nutrition science
10,The Role of Flexibility in Swimming: Stretches That Actually Work,Educational,All,Fitness,Beginner,Blog + Video,4/30/2026,Published,9000,900,450,46000,3680,11500,1150,15000,1500,5400,4:25,25%,270,8.80%,170,3.40%,Flexibility training
11,Competitive Swimming: How to Prepare for Your First Race,Educational,Competitive,Racing,Beginner,Blog + Checklist,5/1/2026,Published,10500,1050,525,58000,4640,12500,1250,17500,1750,6000,4:50,21%,300,10%,200,4.20%,Race preparation guide
12,The Evolution of Swimming Technique: From Ancient Times to Modern Day,Historical,All,History,Beginner,Blog + Infographic,5/2/2026,Published,6500,650,325,32000,2560,7500,750,11000,1100,4200,3:30,35%,210,7%,120,2.40%,Historical perspective
13,How to Choose the Right Swimming Coach: What Parents Should Know,Practical,Parents,Coaching,Beginner,Blog + Checklist,5/3/2026,Published,11000,1100,550,60000,4800,9000,900,18000,1800,6200,5:10,19%,310,10.30%,210,4.50%,Coach selection guide
14,Building Confidence in Water: Proven Strategies for Anxious Swimmers,Motivational,Kids,Psychology,Beginner,Blog + Video,5/4/2026,Published,12500,1250,625,68000,5440,10000,1000,19000,1900,6500,5:20,18%,325,10.80%,220,4.80%,Confidence building
15,The Benefits of Swimming for Mental Health: Science-Backed Evidence,Educational,Adults,Wellness,Beginner,Blog + Infographic,5/5/2026,Published,9500,950,475,50000,4000,12000,1200,16000,1600,5700,4:35,24%,285,9.50%,185,3.90%,Mental health focus
16,Triathlon Training: How to Master the Swimming Component,Educational,Competitive,Triathlon,Intermediate,Blog + Video,5/6/2026,Published,8500,850,425,44000,3520,11000,1100,14500,1450,5300,4:40,25%,265,8.80%,165,3.30%,Triathlon specific
17,The Importance of Proper Pool Etiquette: A Guide for All Swimmers,Practical,All,Community,Beginner,Blog + Infographic,5/7/2026,Published,7000,700,350,36000,2880,8000,800,12500,1250,4600,3:45,32%,230,7.70%,135,2.70%,Community guidelines
18,Swimming for Weight Loss: The Complete Science-Based Guide,Educational,Adults,Fitness,Beginner,Blog + Infographic,5/8/2026,Published,10000,1000,500,54000,4320,11500,1150,17000,1700,5900,4:50,22%,295,9.80%,195,4.10%,Fitness transformation
19,Drowning Prevention: Essential Water Safety Skills Every Child Should Know,Educational,Parents,Safety,Beginner,Blog + Video,5/9/2026,Published,13000,1300,650,70000,5600,13000,1300,20000,2000,6800,5:30,17%,340,11.30%,230,5.20%,Critical safety content
20,The Race Club Method: How Elite Swimmers Train Differently,Educational,Competitive,Training,Advanced,Blog + Video,5/10/2026,Published,9000,900,450,48000,3840,14000,1400,15500,1550,5600,4:45,23%,280,9.30%,180,3.70%,Elite training methods
21,MySwimPro vs Traditional Coaching: Which Is Right for You?,Comparison,All,Coaching,Intermediate,Blog + Comparison Chart,5/11/2026,Published,8500,850,425,42000,3360,10000,1000,14000,1400,5200,4:30,26%,260,8.70%,160,3.20%,Platform comparison
22,The 30-Day Swimming Challenge: Transform Your Technique in One Month,Challenge,All,Training,Beginner,Blog + Video,5/12/2026,Published,11500,1150,575,62000,4960,12000,1200,18500,1850,6100,5:00,20%,305,10.20%,205,4.30%,Challenge format
23,"Swimming Injuries: Prevention, Treatment, and Recovery Strategies",Educational,Competitive,Health,Intermediate,Blog + Infographic,5/13/2026,Published,8000,800,400,40000,3200,9500,950,13500,1350,5000,4:15,28%,250,8.30%,150,3%,Injury prevention
24,"The Art of Pacing: How to Swim Smarter, Not Harder",Educational,Competitive,Racing,Intermediate,Blog + Video,5/14/2026,Published,7500,750,375,38000,3040,10500,1050,12500,1250,4900,4:20,27%,245,8.20%,145,2.90%,Pacing strategy
25,Swimming for Seniors: Age-Appropriate Techniques and Benefits,Educational,Seniors,Fitness,Beginner,Blog + Video,5/15/2026,Published,6500,650,325,30000,2400,8000,800,10500,1050,4300,3:50,33%,215,7.20%,125,2.50%,Senior-focused content
26,The Importance of Warm-Up and Cool-Down: Don't Skip These Steps,Educational,All,Training,Beginner,Blog + Video,5/16/2026,Published,7000,700,350,35000,2800,8500,850,11500,1150,4600,3:55,31%,230,7.70%,135,2.70%,Training fundamentals
27,Swimming with Asthma: How to Manage Your Condition and Thrive,Educational,Kids,Health,Beginner,Blog + Video,5/17/2026,Published,6000,600,300,28000,2240,7500,750,10000,1000,4100,3:40,35%,205,6.80%,120,2.40%,Health-specific content
28,The Science of Flip Turns: Master This Essential Technique,Educational,Competitive,Technique,Intermediate,Blog + Video,5/18/2026,Published,8500,850,425,44000,3520,11000,1100,14000,1400,5200,4:35,25%,260,8.70%,160,3.20%,Technical skill focus
29,Building a Swimming Community: How to Connect with Other Swimmers,Practical,All,Community,Beginner,Blog + Guide,5/19/2026,Published,7500,750,375,36000,2880,8500,850,12000,1200,4700,4:00,30%,235,7.80%,140,2.80%,Community building
30,The Role of Kickboards in Training: Exercises That Strengthen Your Legs,Educational,All,Training,Beginner,Blog + Video,5/20/2026,Published,7000,700,350,34000,2720,8000,800,11000,1100,4500,3:50,32%,225,7.50%,130,2.60%,Equipment usage
31,Swimming Across Open Water: Island Hopping in Hong Kong,Adventure,Adults,Open Water,Intermediate,Blog + Photo Essay,5/21/2026,Published,9500,950,475,50000,4000,10000,1000,15500,1550,5500,4:40,24%,275,9.20%,175,3.50%,Adventure content
32,The Benefits of Group Swimming Classes: Why Community Matters,Motivational,All,Community,Beginner,Blog + Video,5/22/2026,Published,8500,850,425,42000,3360,9500,950,13500,1350,5100,4:25,27%,255,8.50%,155,3.10%,Community benefits
33,Swimming Technique for Different Body Types: Customized Approaches,Educational,All,Technique,Intermediate,Blog + Infographic,5/23/2026,Published,8000,800,400,40000,3200,10000,1000,13000,1300,5000,4:20,28%,250,8.30%,150,3%,Personalized approach
34,The History of Olympic Swimming: From Ancient Games to Modern Records,Historical,All,History,Beginner,Blog + Infographic,5/24/2026,Published,6500,650,325,32000,2560,7500,750,10500,1050,4200,3:35,34%,210,7%,120,2.40%,Olympic history
35,Breathing Patterns: Finding Your Rhythm in the Water,Educational,All,Technique,Beginner,Blog + Video,5/25/2026,Published,9000,900,450,46000,3680,11000,1100,14500,1450,5400,4:30,26%,270,9%,170,3.40%,Breathing fundamentals
36,Swimming for Fitness: How Many Calories Do You Really Burn?,Educational,Adults,Fitness,Beginner,Blog + Infographic,5/26/2026,Published,9500,950,475,48000,3840,11500,1150,15500,1550,5600,4:40,25%,280,9.30%,180,3.60%,Fitness metrics
37,The Mental Game: Overcoming Self-Doubt in the Water,Motivational,Competitive,Psychology,Intermediate,Blog + Video,5/27/2026,Published,8500,850,425,44000,3520,10500,1050,14000,1400,5200,4:35,26%,260,8.70%,160,3.20%,Mental resilience
38,"Water Polo Strategy: Positions, Plays, and Teamwork",Educational,Kids,Water Polo,Intermediate,Blog + Video,5/28/2026,Published,7000,700,350,36000,2880,8500,850,11500,1150,4600,4:00,30%,230,7.70%,135,2.70%,Sport strategy
39,Swimming in Different Climates: Adapting Your Training,Educational,All,Training,Intermediate,Blog + Guide,5/29/2026,Published,6500,650,325,32000,2560,7500,750,10500,1050,4200,3:50,33%,210,7%,120,2.40%,Climate adaptation
40,The Role of Coaches in Swimming Success: What Makes a Great Coach,Practical,Parents,Coaching,Beginner,Blog + Interview,5/30/2026,Published,10000,1000,500,52000,4160,10000,1000,16000,1600,5700,4:50,23%,285,9.50%,185,3.70%,Coach qualities
41,Swimming Nutrition: Pre-Swim and Post-Swim Meals,Educational,Competitive,Nutrition,Beginner,Blog + Meal Plan,5/31/2026,Published,8000,800,400,40000,3200,9500,950,13000,1300,5000,4:20,28%,250,8.30%,150,3%,Nutrition timing
42,The Importance of Rest Days: Why Recovery Matters,Educational,Competitive,Training,Intermediate,Blog + Infographic,6/1/2026,Published,7500,750,375,38000,3040,9000,900,12500,1250,4800,4:15,29%,240,8%,140,2.80%,Recovery science
43,Swimming for Autism: Inclusive Coaching Strategies,Educational,Kids,Special Needs,Beginner,Blog + Video,6/2/2026,Published,7000,700,350,34000,2720,8000,800,11000,1100,4500,4:00,31%,225,7.50%,130,2.60%,Inclusive approach
44,The Evolution of Swimming Goggles: From Past to Present,Product Review,All,Equipment,Beginner,Blog + Comparison,6/3/2026,Published,6000,600,300,28000,2240,7000,700,9500,950,4000,3:40,36%,200,6.70%,115,2.30%,Equipment evolution
45,Swimming Across Borders: International Swimming Competitions,Educational,Competitive,Racing,Intermediate,Blog + Guide,6/4/2026,Published,6500,650,325,32000,2560,7500,750,10500,1050,4200,3:50,33%,210,7%,120,2.40%,International competitions
46,The Science of Streamlining: Reduce Drag and Swim Faster,Educational,Competitive,Technique,Advanced,Blog + Video,6/5/2026,Published,8500,850,425,44000,3520,11000,1100,14000,1400,5200,4:35,26%,260,8.70%,160,3.20%,Hydrodynamics
47,Swimming for Stress Relief: The Mental Health Benefits,Motivational,Adults,Wellness,Beginner,Blog + Video,6/6/2026,Published,10000,1000,500,52000,4160,11000,1100,16000,1600,5700,4:50,23%,285,9.50%,185,3.70%,Wellness focus
48,Competitive Swimming: How to Develop a Winning Mindset,Motivational,Competitive,Psychology,Intermediate,Blog + Video,6/7/2026,Published,8500,850,425,44000,3520,10500,1050,14000,1400,5200,4:35,26%,260,8.70%,160,3.20%,Competitive mindset
49,The Role of Technology in Swimming: Apps and Devices That Help,Product Review,All,Technology,Beginner,Blog + Comparison,6/8/2026,Published,7500,750,375,38000,3040,9000,900,12500,1250,4800,4:15,29%,240,8%,140,2.80%,Tech integration
50,Swimming Across Distances: Training for Long-Distance Swimming,Educational,Competitive,Training,Advanced,Blog + Training Plan,6/9/2026,Published,7000,700,350,36000,2880,8500,850,11500,1150,4600,4:00,30%,230,7.70%,135,2.70%,Distance training
51,The Importance of Proper Posture: Alignment for Efficient Swimming,Educational,All,Technique,Beginner,Blog + Video,6/10/2026,Published,8000,800,400,40000,3200,9500,950,13000,1300,5000,4:20,28%,250,8.30%,150,3%,Posture fundamentals
52,Swimming for Rehabilitation: Recovery from Injury,Educational,Adults,Health,Intermediate,Blog + Guide,6/11/2026,Published,6500,650,325,32000,2560,7500,750,10500,1050,4200,3:50,33%,210,7%,120,2.40%,Rehabilitation focus
53,The Role of Visualization in Swimming: Mental Training Techniques,Educational,Competitive,Psychology,Intermediate,Blog + Video,6/12/2026,Published,8000,800,400,40000,3200,10000,1000,13000,1300,5000,4:20,28%,250,8.30%,150,3%,Mental training
54,Swimming Across Cultures: How Different Countries Train Swimmers,Educational,All,Culture,Intermediate,Blog + Infographic,6/13/2026,Published,6500,650,325,32000,2560,7500,750,10500,1050,4200,3:50,33%,210,7%,120,2.40%,Cultural perspectives
55,The Benefits of Cold Water Swimming: Science and Safety,Educational,Adults,Wellness,Intermediate,Blog + Video,6/14/2026,Published,7500,750,375,38000,3040,9000,900,12500,1250,4800,4:15,29%,240,8%,140,2.80%,Cold water benefits
56,Swimming for Seniors: Age-Appropriate Training Programs,Educational,Seniors,Training,Beginner,Blog + Program,6/15/2026,Published,6000,600,300,28000,2240,7500,750,10000,1000,4100,3:40,35%,205,6.80%,120,2.40%,Senior programs
57,The Role of Resistance Training in Swimming: Dry Land Workouts,Educational,Competitive,Training,Intermediate,Blog + Video,6/16/2026,Published,8000,800,400,40000,3200,9500,950,13000,1300,5000,4:20,28%,250,8.30%,150,3%,Dry land training
58,Swimming Across Seasons: Adapting Your Training Year-Round,Educational,All,Training,Intermediate,Blog + Guide,6/17/2026,Published,7000,700,350,36000,2880,8500,850,11500,1150,4600,4:00,30%,230,7.70%,135,2.70%,Seasonal training
59,The Importance of Flexibility: Stretching Routines for Swimmers,Educational,All,Fitness,Beginner,Blog + Video,6/18/2026,Published,8500,850,425,44000,3520,10000,1000,14000,1400,5200,4:30,26%,260,8.70%,160,3.20%,Flexibility routines
60,Swimming for Weight Management: A Comprehensive Guide,Educational,Adults,Fitness,Beginner,Blog + Infographic,6/19/2026,Published,9000,900,450,46000,3680,11000,1100,14500,1450,5400,4:30,26%,270,9%,170,3.40%,Weight management
61,The Role of Nutrition in Swimming Performance: Fueling Your Body,Educational,Competitive,Nutrition,Intermediate,Blog + Meal Plan,6/20/2026,Published,8000,800,400,40000,3200,9500,950,13000,1300,5000,4:20,28%,250,8.30%,150,3%,Performance nutrition
62,Swimming Across Generations: Teaching Your Children to Swim,Practical,Parents,Coaching,Beginner,Blog + Guide,6/21/2026,Published,9500,950,475,50000,4000,10000,1000,15500,1550,5500,4:40,24%,275,9.20%,175,3.50%,Family swimming
63,The Benefits of Swimming for Cardiovascular Health,Educational,Adults,Health,Beginner,Blog + Infographic,6/22/2026,Published,9000,900,450,46000,3680,11000,1100,14500,1450,5400,4:30,26%,270,9%,170,3.40%,Cardiovascular benefits
64,Swimming Technique: The Importance of Consistency,Educational,All,Technique,Beginner,Blog + Video,6/23/2026,Published,7500,750,375,38000,3040,9000,900,12500,1250,4800,4:15,29%,240,8%,140,2.80%,Consistency focus
65,The Role of Coaching in Competitive Swimming: What You Need to Know,Educational,Competitive,Coaching,Intermediate,Blog + Interview,6/24/2026,Published,8000,800,400,40000,3200,10000,1000,13000,1300,5000,4:20,28%,250,8.30%,150,3%,Coaching importance
66,Swimming for Anxiety: How Water Can Calm Your Mind,Motivational,Adults,Wellness,Beginner,Blog + Video,6/25/2026,Published,10000,1000,500,52000,4160,11000,1100,16000,1600,5700,4:50,23%,285,9.50%,185,3.70%,Anxiety relief
67,The Science of Swimming: Understanding Hydrodynamics,Educational,Competitive,Science,Advanced,Blog + Infographic,6/26/2026,Published,7000,700,350,36000,2880,8500,850,11500,1150,4600,4:00,30%,230,7.70%,135,2.70%,Hydrodynamics science
68,Swimming Across Abilities: Inclusive Coaching for All,Educational,All,Coaching,Beginner,Blog + Guide,6/27/2026,Published,8500,850,425,44000,3520,10000,1000,14000,1400,5200,4:30,26%,260,8.70%,160,3.20%,Inclusive coaching
69,The Role of Breathing in Swimming: Mastering the Fundamentals,Educational,All,Technique,Beginner,Blog + Video,6/28/2026,Published,9000,900,450,46000,3680,11000,1100,14500,1450,5400,4:30,26%,270,9%,170,3.40%,Breathing mastery
70,Swimming for Confidence: Building Self-Esteem in the Water,Motivational,Kids,Psychology,Beginner,Blog + Video,6/29/2026,Published,11000,1100,550,58000,4640,12000,1200,17500,1750,6000,4:50,21%,300,10%,200,4.20%,Confidence building
71,The Importance of Water Safety: Essential Skills for All Ages,Educational,All,Safety,Beginner,Blog + Video,6/30/2026,Published,12000,1200,600,64000,5120,13000,1300,19000,1900,6500,5:10,19%,325,10.80%,220,4.60%,Safety critical
72,Swimming Technique: The Role of Core Strength,Educational,Competitive,Fitness,Intermediate,Blog + Video,7/1/2026,Published,8000,800,400,40000,3200,9500,950,13000,1300,5000,4:20,28%,250,8.30%,150,3%,Core strength
73,The Benefits of Swimming for Joint Health,Educational,Seniors,Health,Beginner,Blog + Infographic,7/2/2026,Published,7000,700,350,36000,2880,8500,850,11500,1150,4600,4:00,30%,230,7.70%,135,2.70%,Joint health
74,Swimming Across Distances: Marathon Swimming Guide,Educational,Competitive,Training,Advanced,Blog + Training Plan,7/3/2026,Published,6500,650,325,32000,2560,7500,750,10500,1050,4200,3:50,33%,210,7%,120,2.40%,Marathon swimming
75,The Role of Technique in Swimming Speed: Efficiency Over Power,Educational,Competitive,Technique,Intermediate,Blog + Video,7/4/2026,Published,8500,850,425,44000,3520,11000,1100,14000,1400,5200,4:35,26%,260,8.70%,160,3.20%,Technique efficiency
76,Swimming for Mental Clarity: The Meditative Benefits,Motivational,Adults,Wellness,Beginner,Blog + Video,7/5/2026,Published,9500,950,475,50000,4000,10500,1050,15500,1550,5500,4:40,24%,275,9.20%,175,3.50%,Mental clarity
77,The Importance of Proper Equipment: Choosing the Right Gear,Practical,All,Equipment,Beginner,Blog + Buying Guide,7/6/2026,Published,7500,750,375,38000,3040,9000,900,12500,1250,4800,4:15,29%,240,8%,140,2.80%,Equipment guide
78,Swimming Across Cultures: International Training Methods,Educational,All,Culture,Intermediate,Blog + Infographic,7/7/2026,Published,6500,650,325,32000,2560,7500,750,10500,1050,4200,3:50,33%,210,7%,120,2.40%,International methods
79,The Role of Consistency in Swimming: Building Habits,Motivational,All,Training,Beginner,Blog + Guide,7/8/2026,Published,8000,800,400,40000,3200,9500,950,13000,1300,5000,4:20,28%,250,8.30%,150,3%,Habit building
80,Swimming for Longevity: Health Benefits Across the Lifespan,Educational,All,Health,Beginner,Blog + Infographic,7/9/2026,Published,8500,850,425,44000,3520,10500,1050,14000,1400,5200,4:35,26%,260,8.70%,160,3.20%,Longevity focus
81,The Science of Swimming Strokes: Biomechanics Explained,Educational,Competitive,Science,Advanced,Blog + Video,7/10/2026,Published,7500,750,375,38000,3040,10000,1000,12500,1250,4800,4:15,29%,240,8%,140,2.80%,Biomechanics
82,Swimming for Stress Management: A Holistic Approach,Motivational,Adults,Wellness,Beginner,Blog + Video,7/11/2026,Published,9000,900,450,46000,3680,11000,1100,14500,1450,5400,4:30,26%,270,9%,170,3.40%,Stress management
83,The Role of Pacing in Swimming: Strategic Race Planning,Educational,Competitive,Racing,Intermediate,Blog + Video,7/12/2026,Published,7500,750,375,38000,3040,9500,950,12500,1250,4800,4:15,29%,240,8%,140,2.80%,Race strategy
84,Swimming Across Abilities: Adaptive Swimming Techniques,Educational,All,Special Needs,Intermediate,Blog + Video,7/13/2026,Published,7000,700,350,36000,2880,8500,850,11500,1150,4600,4:00,30%,230,7.70%,135,2.70%,Adaptive techniques
85,The Benefits of Swimming for Immune Health,Educational,All,Health,Beginner,Blog + Infographic,7/14/2026,Published,8000,800,400,40000,3200,9500,950,13000,1300,5000,4:20,28%,250,8.30%,150,3%,Immune benefits
86,Swimming Technique: The Importance of Feedback,Educational,All,Coaching,Beginner,Blog + Video,7/15/2026,Published,7500,750,375,38000,3040,9000,900,12500,1250,4800,4:15,29%,240,8%,140,2.80%,Feedback importance
87,The Role of Mental Training in Swimming Success,Educational,Competitive,Psychology,Intermediate,Blog + Video,7/16/2026,Published,8500,850,425,44000,3520,11000,1100,14000,1400,5200,,,,,,,
